claim_text,claimant,claim_date,review_date,rating,publisher_domain,review_title,review_url,language,language_name,data_source,extraction_method
ભારત જોડ યાત્રા તેના અંતિમ ચરણમાં પહોંચવા જઈ રહી છે. સોશ્યલ મીડિયા પર યાત્રાને લઈને અનેક પ્રકારે ભ્રામક અફવાઓ ફેલાઈ રહી છે. જે ક્રમમાંફેસબુકયુઝર ચૂંટલી એક્સપ્રેસ દ્વારા “ભારતના તિરંગાને ઉખાડવા માંગે છે આ પપ્પૂ?” ટાઇટલ સાથે રાહુલ ગાંધીનો એક વિડીયો શેર કરવામાં આવેલ છે.,,,"Jan 6, 2023",Missing Context,newschecker.in,રાહુલ ગાંધીના ભાષણનો અધૂરો વિડીયો ભ્રામક દાવા સાથે વાયરલ,https://newschecker.in/gu/fact-checks-gu/fact-checks-gu/rahul-gandhi-bharat-jodo-yatara-old-video,gu,Gujarati,newschecker_scrape,html_fallback
"કોંગ્રેસની ભારત જોડો યાત્રા હાલ હરિયાણાથી પંજાબ જઈ રહી છે. આ દરમિયાન, સાંસદ અને કોંગ્રેસ નેતા રાહુલ ગાંધીની એક તસ્વીર સોશિયલ મીડિયા પર ખૂબ વાયરલ થયો છે, જેમાં તેઓ ડાઇનિંગ ટેબલ પર ડ્રાય ફ્રૂટ્સ, માખાના સાથે નોન-વેજ ડીશ અને આલ્કોહોલ લઇ રહ્યા છે.",,,"Jan 10, 2023",Altered Photo,newschecker.in,રાહુલ ગાંધી નોન વેજ અને દારૂનો ગ્લાસ લઈને બેઠા હોવાના દાવા સાથે ભ્રામક તસ્વીર વાયરલ,https://newschecker.in/gu/fact-checks-gu/fact-checks-gu/rahul-gandhi-liquor-non-veg-fake,gu,Gujarati,newschecker_scrape,html_fallback
WeeklyWrap : પીએમ મોદીએ તેમની માતાના અવસાન બાદ મુંડન કર્યું વાયરલ તો આ તરફ રાહુલ ગાંધીના ભાષણનો અધૂરો વિડીયો વાયરલ થયો અને ગુજરાતની શાળામાં મુસ્લિમ યુવક દ્વારા તોડફોડ કરવામાં આવી હોવાના દાવા સાથે વાયરલ થયેલ ભ્રામક અફવાઓ પર TOP ફેકટચેક,,,"Jan 7, 2023",,newschecker.in,WeeklyWrap : પીએમ મોદીની માતાના અવસાનથી લઈને રાહુલ ગાંધીની ભારત જોડો યાત્રા સાથે જોડાયેલ ભ્રામક અફવાઓ,https://newschecker.in/gu/fact-checks-gu/fact-checks-gu/weeklywrap-top-5-factcheck,gu,Gujarati,newschecker_scrape,html_fallback
"ચીનમાં કોરોનાના કેસ વધતા ફરીવાર ભારત સરકાર હરકતમાં આવી છે. કેન્દ્રીય આરોગ્યમંત્રી મનસુખ માંડવિયાએ પણ કોરોનાની સ્થિતિ અને સમીક્ષા માટે એક બેઠક બોલાવી હતી. આ ઉપરાંત, કોરોના વાયરસના ભયને લઈને સરકારે જાહેર સ્થળો પર માસ્ક પહેરવા પણ અપીલ કરવામાં આવી છે. સોશ્યલ મીડિયા પર પણ કોરોના વાયરસ અંગે ફરી એક વખત અનેક પોસ્ટ જોવા મળી રહી છે. આ ક્રમમાં કોરોના વાયરસનો એક નવો જીવલેણ વેરીએન્ટ XBB ભારતમાં આવ્યો હોવાના દાવા સાથે એક મેસેજ વોટ્સએપ ગ્રુપ અને ફેસબુક યુઝર્સ શેર કરી રહ્યા છે.",,,"Dec 23, 2022",False,newschecker.in,કોરોના વાયરસના નવા XBB ડેલ્ટા વેરિઅન્ટ અંગે નકલી અને બનાવટી મેસેજ વાયરલ,https://newschecker.in/gu/fact-checks-gu/coronavirus-gu/covid-xbb-variant-viral-msg-no-basis-in-facts,gu,Gujarati,newschecker_scrape,html_fallback
"ગુજરાત વિધાનસભા ચૂંટણીમાં ભાજપની જંગી જીત થઈ અને ફરી એક વખત સરકાર બનાવવામાં ભાજપ સફળ રહી. ચૂંટણી પ્રચાર થી લઈને મંત્રી મંડળ બનાવા સુધી સોશ્યલ મીડિયા પર અનેક અફવાઓ ફેલાઈ હતી. આ ક્રમમાં ફેસબુક પર ભાજપ નેતા અલ્પેશ ઠાકોરનો વિડીયો વાયરલ થયેલ છે, જેમાં તેઓ કોંગ્રેસ નેતા અને વાવ-થરાદ વિધાનસભા ઉમેદવાર ગેનીબેન ઠાકોરના સમર્થનમાં પ્રચાર કરી રહ્યા છે.",,,"Dec 19, 2022",Missing Context,newschecker.in,અલ્પેશ ઠાકોરનો 2017નો જૂનો વિડીયો વિધાનસભા ચૂંટણીના ભ્રામક સંદર્ભમાં થયો વાયરલ,https://newschecker.in/gu/fact-checks-gu/fact-checks-gu/alpesh-thakor-old-video-gujarat-election,gu,Gujarati,newschecker_scrape,html_fallback
માનવ સર્જિત રોબોટ અને વ્યક્તિ વચ્ચેની ક્રિયાપ્રતિક્રિયા શું હોય શકે છે તે દર્શાવતો એક વીડિયો સોશિયલ મીડિયા પ્લેટફોર્મ પર વ્યાપકપણે શેર કરવામાં આવી રહ્યો છે. દાવો કરવામાં આવી રહ્યો છે કે “આ ચીનમાં બનાવેલી કૃત્રિમ મહિલા” છે. આ રોબોટ ચીનના બજારોમાં લોન્ચ કરવામાં આવેલ છે જે એક ચાર્જ પર 72 કલાકથી વધુ કામ કરે છે.,,,"Dec 20, 2022",False,newschecker.in,ચાઇના દ્વારા કૃત્રિમ મહિલા બનાવવામાં આવી હોવાના ભ્રામક દાવા સાથે ગેમિંગ વિડીયો વાયરલ,https://newschecker.in/gu/fact-checks-gu/fact-checks-gu/artificial-woman-made-in-china-false,gu,Gujarati,newschecker_scrape,html_fallback
કોંગ્રેસની ભારત જોડો યાત્રા આ સમયે રાજેસ્થાનમાં ચાલી રહી છે. સોશિયલ મીડિયા પર એક વીડિયો વાયરલ થઈ રહ્યો છે.જ્યાં હજારો લોકોની આ ભીડમાં કોંગ્રેસના નેતા અને સાંસદ રાહુલ ગાંધી પણ રસ્તા પર જોવા મળી રહ્યા છે. દાવો કરવામાં આવી રહ્યો છે કે આ વીડિયો ઈન્દોરનો છે જ્યાં ભારત જોડો યાત્રા દરમિયાન ભારે ભીડ જોવા મળી હતી.,,,"Dec 16, 2022",Partly False,newschecker.in,ઇન્દોર ખાતે ભારત જોડો યાત્રામાં ભારે ભીડ હોવાના દાવા સાથે કર્ણાટકનો વિડીયો વાયરલ,https://newschecker.in/gu/fact-checks-gu/fact-checks-gu/bharat-jodo-yatra-indore,gu,Gujarati,newschecker_scrape,html_fallback
સોશ્યલ મીડિયા પર એક વિડીયો વાયરલ થઈ રહ્યો છે. દાવો કરવામાં આવ્યો છે કે મહારાષ્ટ્રની એક કોર્ટમાં મહિલા જજ અને મહિલા વકીલ વચ્ચે મારામારી થઈ છે. વીડિયોમાં બે મહિલાઓ કોર્ટ પરિસરમાં એક કેસ મુદ્દે મારામારી કરતા જોવા મળે છે.,,,"Dec 26, 2022",False,newschecker.in,શું મહારાષ્ટ્ર કોર્ટની બહાર મહિલા જજે વકીલને માર માર્યો? જાણો વાયરલ વિડીયોનું સત્ય,https://newschecker.in/gu/fact-checks-gu/fact-checks-gu/judge-beat-up-lawyer-outside-maharashtra-court,gu,Gujarati,newschecker_scrape,html_fallback
"રવિવારે ફિફા વર્લ્ડકપ (FIFA WC 2022) જીત્યા બાદ મેદાન પર મેસ્સીને ગળે લગાવતી એક મહિલાનો વીડિયો સોશિયલ મીડિયા પર વાયરલ થઈ રહ્યો છે. યુઝર્સ દાવો કરી રહ્યા છે કે તે ફાઇનલમાં ફ્રાન્સ સામેની જીત બાદ મેસ્સી તેની માતા, સેલિયા મારિયા કુસીટીનીને ગળે લગાવે છે. ન્યૂઝચેકરને આ દાવો ખોટો હોવાનું જણાયું છે, વાયરલ ક્લિપમાં દેખાતી મહિલા મેસ્સીની માતા નથી.",,,"Dec 22, 2022",False,newschecker.in,ફિફા વર્લ્ડકપ જીત્યા બાદ મેસ્સી તેની માતાને ભેટીને ભાવુક થયો હોવાના ભ્રામક દાવા સાથે વિડીયો વાયરલ,https://newschecker.in/gu/fact-checks-gu/fact-checks-gu/lionel-messi-hugs-mother-viral-video,gu,Gujarati,newschecker_scrape,html_fallback
શાહરુખ ખાનની આવનારી ફિલ્મ પઠાણને લઈને ચાલતા વિવાદના ક્રમમાં નરેન્દ્ર મોદીના ભાષણનો એક વીડિયો વાયરલ થઈ રહ્યો છે. દાવો કરવામાં આવી રહ્યો છે કે પીએમ મોદી એક ભાષણ દરમિયાન પોતાને “પઠાન કા બચ્ચા” ગણાવી રહ્યા છે.,,,"Dec 27, 2022",False,newschecker.in,શાહરુખ ખાનની ફિલ્મ પઠાણને લઈને પીએમ મોદીનો જૂનો વિડીયો વાયરલ,https://newschecker.in/gu/fact-checks-gu/fact-checks-gu/modi-pathan-ka-bachcha-sahrukh-khan,gu,Gujarati,newschecker_scrape,html_fallback
"ભારતીય મહિલા ગણિતશાસ્ત્રી નીના ગુપ્તા વિશે કેટલાક સોશિયલ મીડિયા યુઝર્સ દ્વારા દાવો કરવામાં આવી રહ્યો છે. જે મુજબ, નીના ગુપ્તા દેશની પ્રથમ મહિલા ગણિતશાસ્ત્રી છે જેને પ્રતિષ્ઠિત રામાનુજન એવોર્ડ એનાયત કરવામાં આવ્યો છે .",,,"Dec 28, 2022",Partly False,newschecker.in,શું નીના ગુપ્તા રામાનુજન એવોર્ડ મેળવનાર પ્રથમ ભારતીય મહિલા છે? જાણો શું છે સત્ય,https://newschecker.in/gu/fact-checks-gu/fact-checks-gu/neena-gupta-ramanujan-award,gu,Gujarati,newschecker_scrape,html_fallback
સોશિયલ મીડિયા પર એક વીડિયો શેર કરવામાં આવ્યો છે. દાવો કરવામાં આવ્યો છે કે કાશ્મીરમાં પોલીસ દ્વારા કથિત રીતે પાકિસ્તાન ઝિંદાબાદના નારા લગાવવા બદલ રાજસ્થાની યુવકોને માર મારવામાં આવ્યો છે. વાયરલ વીડિયોમાં કેટલાક યુવકો ઘાયલ અવસ્થામાં જમીન પર પડ્યા છે અને સુરક્ષાકર્મીઓ તે યુવકોને વંદે માતરમ અને રાષ્ટ્રગીત ગાવાનું કહી રહ્યા છે.,,,"Dec 30, 2022",False,newschecker.in,દિલ્હીમાં થયેલા રમખાણોનો વિડીયો કાશ્મીરનો હોવાના ભ્રામક દાવા સાથે વાયરલ,https://newschecker.in/gu/fact-checks-gu/fact-checks-gu/police-beaten-youth-kashmir-youth-pakistan-zindabaad-delhi-riots,gu,Gujarati,newschecker_scrape,html_fallback
"WeeklyWrap : ઇન્દોર ખાતે ભારત જોડો યાત્રામાં ભારે ભીડ હોવાના દાવા સાથે જૂનો વિડીયો વાયરલ થયો તો આ તરફ મેચ જીત્યા બાદ માતાને ભેટી ભાવુક થયો મેસી જયારે, કોરોના વાયરસના નવા XBB ડેલ્ટા વેરિઅન્ટ અંગે નકલી અને બનાવટી મેસેજ વાયરલ",,,"Dec 24, 2022",,newschecker.in,"WeeklyWrap : ભારત જોડો યાત્રા, ફિફા વર્લ્ડકપ અને કોરોના વાયરસ અંગે ફેલાયેલ ભ્રામક અફવાઓ",https://newschecker.in/gu/fact-checks-gu/fact-checks-gu/weeklywrap-fact-check-top-fake-news-11,gu,Gujarati,newschecker_scrape,html_fallback
"WeeklyWrap : મહારાષ્ટ્ર કોર્ટની બહાર મહિલા જજે વકીલને માર માર્યો તો બીજી તરફ કાશ્મીરમાં પોલીસ દ્વારા કથિત રીતે પાકિસ્તાન ઝિંદાબાદના નારા લગાવવા બદલ રાજસ્થાની યુવકોને માર માર્યો હોવાના દાવા સાથે વિડીયો વાયરલ થયો, જયારે શાહરુખ ખાનની ફીમ પઠાણ મુદ્દે પીએમ મોદીનો જૂનો વિડીયો ભ્રામક દાવા સાથે વાયરલ થયો હતો.",,,"Dec 31, 2022",,newschecker.in,WeeklyWrap : શાહરુખ ખાનની ફિલ્મ પઠાણના વિવાદથી લઈને સોશ્યલ મીડિયા પર ફેલાયેલ અન્ય ભ્રામક દાવાઓ,https://newschecker.in/gu/fact-checks-gu/fact-checks-gu/weeklywrap-fact-check-top-fake-news-12,gu,Gujarati,newschecker_scrape,html_fallback
"સમાચાર અને ઘટનાઓના સંદર્ભમાં 2022 ખુબ રોમાંચક હતું. યુક્રેન-રશિયાના યુદ્ધથી લઈને રાણી એલિઝાબેથના અવસાન સુધી, ઋષિ સુનાકના બ્રિટિશ પીએમ બનવાથી લઈને ઈમરાન ખાન પાકિસ્તાનના વડા પ્રધાન તરીકેનું સ્થાન ગુમાવવા સુધી, મહસા અમીનીના મૃત્યુ પછી ઈરાનમાં થયેલા બળવાથી લઈને ખૂબ જ વિવાદાસ્પદ કતાર Fifa WC સુધી આ વર્ષ આ તમામ ઘટનાઓનુ સાક્ષી હતું. જેમ-જેમ આ યાદગાર વર્ષ તેના અંત તરફ આવી રહ્યું છે તેમ, ન્યૂઝચેકરે 2022માં સૌથી વધુ વાયરલ થયેલ ભ્રામક અફવાઓ પર એક નજર કરીએ",,,"Dec 31, 2022",,newschecker.in,ભ્રામક અફવાનું સત્ય : 2022ના ટોપ 10 ફેક્ટ ચેક,https://newschecker.in/gu/fact-checks-gu/fact-checks-gu/year-in-misinformation-top-10-fact-checks-of-2022,gu,Gujarati,newschecker_scrape,html_fallback
રાજ્યમાં તાજેતરમાં યોજાયેલી વિધાનસભાની ચૂંટણીમાં આમ આદમી પાર્ટી લગભગ 50 બેઠકો પર જીતી શકે છે તેવો દાવો કરતા બે ગ્રાફિક્સ વાયરલ થઈ રહ્યા છે. ન્યૂઝચેકરને જાણવા મળ્યું કે આ બન્ને ગ્રાફિક્સ ડિજિટલી એડિટ કરવામાં આવ્યા છે.,,,"Dec 7, 2022",Altered Photo,newschecker.in,ગુજરાતમાં AAP 49-54 બેઠકો પર જીત મેળવી રહી હોવાના દાવા સાથે એડિટેડ ન્યુઝ ગ્રાફિક વાયરલ,https://newschecker.in/gu/fact-checks-gu/fact-checks-gu/49-54-seats-for-aap-in-gujarat-election-edited,gu,Gujarati,newschecker_scrape,html_fallback
"ગુજરાત વિધાનસભા ચૂંટણી માટે મતદાન પ્રક્રિયા પૂર્ણ થઈ આવતી કાલે ચૂંટણી પરિણામો જાહેર થશે અને ગુજરાતમાં રાજકીય પડઘમ શાંત પડી જશે. ચૂંટણી સંદર્ભે અનેક ભ્રામક ખબરો ફેલાઈ હતી. આ જ ક્રમમાં વિધાનસભા ચૂંટણીના બીજા તબક્કાના મતદાન અગાઉ કોંગ્રેસ અધ્યક્ષ જગદીશ ઠાકોરનો એક વિડીયો વાયરલ થઈ રહ્યો હતો. દાવો કરવામાં આવ્યો છે કે “ગુજરાત કોંગ્રેસના પ્રદેશ પ્રમુખ પાટીદારોને સીધા કરીને મત લઈશ તથા બક્ષીપંચ, દલીત અને આદીવાસી સમાજને એક કોથળી દારૂ અને ચપટી ચવાણું માં પટાવી દઈશ એવું જાહેર સભામાં બોલી રહ્યા છે.”",,,"Dec 7, 2022",Missing Context,newschecker.in,કોંગ્રેસ નેતા જગદીશ ઠાકોરનો જૂનો વિડીયો ભ્રામક દાવા સાથે વાયરલ,https://newschecker.in/gu/fact-checks-gu/fact-checks-gu/congress-jagdish-thakor-old-video-viral,gu,Gujarati,newschecker_scrape,html_fallback
"ગુજરાત વિધાનસભા ચૂંટણીના પરિણામો EVMમાં કેદ થઈ ગયા છે, 8 ડિસેમ્બરના ચૂંટણી પરિણામો જાહેર થવાના છે. આ પહેલા સોશ્યલ મીડિયા પર તેમજ ન્યુઝ ચેનલો દ્વારા જાહેર કરવામાં આવેલ એક્ઝિટ પોલની કેટલીક તસ્વીર વાયરલ થઈ રહી છે.",,,"Dec 6, 2022",Altered Image,newschecker.in,વિધાનસભા ચૂંટણીના પરિણામોને લઈને ન્યુઝ ચેનલના એક્ઝિટ પોલની એડિટેડ તસ્વીર વાયરલ,https://newschecker.in/gu/fact-checks-gu/fact-checks-gu/edited-abp-news-poll-gujarat-election,gu,Gujarati,newschecker_scrape,html_fallback
ગુજરાત વિધાનસભાની ચૂંટણીમાં પ્રથમ તબક્કાનું મતદાન પૂર્ણ થયું છે. વિધાનસભાની 182 પૈકી 89 બેઠકો પરના મતો EVMમાં કેદ થઈ ગયા છે. 73.02 ટકા સાથે નર્મદા જિલ્લામાં સૈથી વધુ મતદાન થયું છે. જ્યારે સૌથી ઓછું 53.83 ટકા મતદાન પોરબંદર જિલ્લામાં નોંધાયું છે. આ ક્રમમાં સુરતના વરાછા વિસ્તારમાં બોગસ મતદાન થયું હોવાનો એક વિડીયો વાયરલ થઈ રહ્યો છે.,,,"Dec 2, 2022",False,newschecker.in,સુરતના વરાછામાં બોગસ મતદાન થયું હોવાના ભ્રામક દાવા સાથે વિડીયો વાયરલ,https://newschecker.in/gu/fact-checks-gu/fact-checks-gu/fake-voting-surat-varacha-evm-gujarat-election,gu,Gujarati,newschecker_scrape,html_fallback
"ગુજરાત વિધાનસભા ચૂંટણીના પ્રથમ ચરણનું મતદાન ગઈકાલે સમાપ્ત થયું, તો બીજી તરફ બીજા ચરણની તૈયારીમાં અમદાવાદ ખાતે પીએમ મોદીએ ગઈકાલે એક રોડ-શો કર્યો હતો. તમામ પક્ષોએ પોતાના વાયદા-વચનો જાહેર કરી દીધા છે. આ ક્રમમાં ગુજરાત ભાજપ દ્વારા જાહેર કરવામાં આવેલ સંકલ્પ પત્રનું એક પોસ્ટર કેટલાક ભાજપ નેતાઓ અને પાર્ટીના ઓફિશ્યલ એકાઉન્ટ પરથી શેર કરવામાં આવેલ છે.",,,"Dec 2, 2022",Missing Context,newschecker.in,ભાજપના સંકલ્પ પત્રના પોસ્ટરમાં ઈન્ફ્રાસ્ટ્રક્ચરના મુદ્દે મુંબઈના એક ફ્લાયઓવરની તસ્વીર શેર કરવામાં આવી,https://newschecker.in/gu/fact-checks-gu/fact-checks-gu/gujarat-bjp-sankalp-patra-mymbai-flyover,gu,Gujarati,newschecker_scrape,html_fallback
ગુજરાત વિધાનસભા ચૂંટણીનું આજે બીજા તબક્કાનું મતદાન ચાલી રહ્યું છે. પીએમ મોદીએ આજે અમદવાદના રાણીપ ખાતે વહેલી સવારે મતદાન કર્યું હતું. બીજી તરફ મોરબી ખાતે બ્રિજ તૂટી પડવાની દુઃખદ ઘટનાને પણ થોડા દિવસો જ થયા છે. સોશ્યલ મીડિયા પર એક ન્યુઝ પેપર કટિંગ વાયરલ થઈ રહ્યું છે અને દાવો કરવામાં આવ્યો છે કે નરેન્દ્ર મોદીની મોરબી મુલાકાત પાછળ 30 કરોડ રૂપિયાનો ખર્ચ થયો છે.,,,"Dec 5, 2022",False,newschecker.in,નરેન્દ્ર મોદીની મોરબી મુલાકાત પાછળ 30 કરોડ રૂપિયાનો ખર્ચ થયો હોવાના ભ્રામક દાવા સાથે ન્યુઝ પેપર કટિંગ વાયરલ,https://newschecker.in/gu/fact-checks-gu/fact-checks-gu/modi-morbi-visit-30-cr-spent-rti-reveal,gu,Gujarati,newschecker_scrape,html_fallback
