claim_text,claimant,claim_date,review_date,rating,publisher_domain,review_title,review_url,language,language_name,data_source,extraction_method
"દલવીર ભંડારી ઈન્ટરનેશનલ કોર્ટ ઓફ જસ્ટિસ વિશે એક સમાચાર સોશિયલ મીડિયા પર વાયરલ થઈ રહ્યા છે. દાવો કરવામાં આવી રહ્યો છે કે, તેમને ઈન્ટરનેશનલ કોર્ટ ઓફ જસ્ટિસના મુખ્ય ન્યાયાધીશ બનાવવામાં આવ્યા છે. વાયરલ દાવા મુજબ, આ પદ 71 વર્ષ સુધી ગ્રેટ બ્રિટન પાસે હતું. પરંતુ, આ વખતે જ્યારે આ પદ માટે મતદાન થયું ત્યારે દલવીર ભંડારીને 193માંથી 183 મત મળ્યા હતા.",,,"Dec 20, 2021",-Misplaced Context,newschecker.in,"દલવીર ભંડારી ઈન્ટરનેશનલ કોર્ટ ઓફ જસ્ટિસના ચીફ જસ્ટિસ તરીકે ચૂંટાયા હોવાનો ભ્રામક દાવો વાયરલ, જાણો શું છે સત્ય",https://newschecker.in/gu/fact-checks-gu/fact-checks-gu/dalveer-bhandari-chief-justice-icj,gu,Gujarati,newschecker_scrape,html_fallback
PM મોદી ની NGO અંગે જાહેરાત તો બીજી તરફ ચૂંટણી આયોગ દ્વારા મતદાન અંગે કરવામાં આવેલ જાહેરાત તેમજ મહારાષ્ટ્ર બોર્ડના પરીક્ષા ફોર્મમાં હિન્દૂ કોલમ માટે સોશ્યલ મીડિયા પર ફેલાયેલ ભ્રામક અફવાઓ પર TOP 5 ફેકટચેક,,,"Dec 4, 2021",,newschecker.in,WeeklyWrap : PM મોદીની જાહેરાતો અને વિધાનસભા ચૂંટણીના મુદ્દાઓ થી લઇ મહારાષ્ટ્ર બોર્ડના પરીક્ષા મુદ્દે વાયરલ થયેલ ભ્રામક અફવાઓ,https://newschecker.in/gu/fact-checks-gu/fact-checks-gu/fact-checks-weeklywrap-top-5-fake-news-16,gu,Gujarati,newschecker_scrape,html_fallback
CDS બિપીન રાવત ના હેલિકોપ્ટર ક્રેશ થયાનો લાઈવ વીડિયો બીજી તરફ રાજસ્થાનમાં ઓમિક્રોનના વધતા જતા કેસોને કારણે શૈક્ષણિક સંસ્થાઓ બંધ કરવામાં આવી અને પ્રધાનમંત્રી રામબાણ સુરક્ષા યોજના અંગે ફેલાયેલ ભ્રામક દાવાઓ પર કરવામાં આવેલ TOP 5 ફેક્ટ ચેક,,,"Dec 11, 2021",,newschecker.in,WeeklyWrap : જનરલ બિપિન રાવતના હેલિકોપ્ટર ક્રેશના વિડિઓ થી લઇ PM યોજના અંગે ફેલાયેલ ભ્રામક અફવા,https://newschecker.in/gu/fact-checks-gu/fact-checks-gu/fact-checks-weeklywrap-top-5-fake-news-17,gu,Gujarati,newschecker_scrape,html_fallback
CM યોગી આદિત્યનાથના કાફલા પર હુમલો બીજી તરફ લગ્નના વરઘોડામાં બગ્ગીમાં આગ અને મુસ્લિમ જીમ ટ્રેનર હિંદુ યુવતીઓ ફસાવી જીમ જેહાદ કરી રહ્યા હોવાના દાવા સાથે વાયરલ થયેલ તમામ ભ્રામક ખબરો પર TOP ફેક્ટ ચેક,,,"Dec 18, 2021",,newschecker.in,WeeklyWrap : યોગી આદિત્યનાથના કાફલા પર હુમલો થયો હોવાથી બિપિન રાવતના ચોપર ક્રેશ પર વાયરલ થયેલ ભ્રામક ખબરો,https://newschecker.in/gu/fact-checks-gu/fact-checks-gu/fact-checks-weeklywrap-top-5-fake-news-18,gu,Gujarati,newschecker_scrape,html_fallback
"ભારતના આર્મી ચીફ જનરલ બિપિન રાવતનું તમિલનાડુના કુન્નૂરમાં હેલિકોપ્ટર દુર્ઘટનામાં દુઃખદ અવસાન થયું છે. તામિલનાડુ એર બેઝ પરથી વેલિંગ્ટન જવા માટે સીડીએસ બિપિન રાવત સહિત કુલ 14 લોકોએ હેલિકોપ્ટરમાં ઉડાણ ભરી હતી, ત્યારે કુન્નૂરમાં તેમનું હેલિકોપ્ટર ક્રેશ થયું હતું. આ ક્રમમાં સોશ્યલ મીડિયા પર હેલિકોપ્ટરનું ક્રેશ લેન્ડિંગ દર્શાવતો એક વીડિયો શેર કરવામાં આવી રહ્યો છે.",,,"Dec 9, 2021",- Misplaced Context,newschecker.in,અરુણાચલમાં થયેલ Mi-17 ક્રેશ લેન્ડિંગનો વીડિયો જનરલ બિપિન રાવતના હેલિકોપ્ટર ક્રેશનો હોવાના ભ્રામક દાવા સાથે વાયરલ,https://newschecker.in/gu/fact-checks-gu/fact-checks-gu/false-video-shared-chopper-crash-bipin-rawat,gu,Gujarati,newschecker_scrape,html_fallback
"કોરોના વાયરસની લહેર બાદ લગ્ન પ્રસંગે લોકોની મર્યાદા હટાવવામાં આવી છે. ઉલ્લેખનીય છે કે કોરોના કાળમાં માર્યાદિત લોકો સાથે લગ્ન પ્રસંગની છૂટ આપવામાં આવી હતી. અત્યારે લગ્નની સીઝન ચાલી રહી છે, જે ક્રમમાં સોશ્યલ મીડિયા પર અનેક લોકો દ્વારા પોસ્ટ શેર કરવામાં આવતી હોય છે. હાલમાં લગ્નમાં વરઘોડા સમયે બગ્ગીમાં આગ લાગવાનો વીડીઓ વાયરલ થયો છે.",,,"Dec 16, 2021",- Misplaced Context,newschecker.in,લગ્નના વરઘોડામાં બગ્ગીમાં આગ લાગવાની ઘટના સુરત શહેરની હોવાના ભ્રામક દાવા સાથે વિડિઓ વાયરલ,https://newschecker.in/gu/fact-checks-gu/fact-checks-gu/fire-broke-out-in-the-buggy-at-the-wedding-party,gu,Gujarati,newschecker_scrape,html_fallback
"ભારતમાં ભાજપની સરકાર આવ્યા બાદ વડાપ્રધાન મોદીએ અનેક વિકાસ યોજનાઓની જાહેરાત કરી હતી, જેમાંથી એક ડિજિટલ ઈન્ડિયા હતી. ડિજિટલ ઈન્ડિયા અભિયાન હેઠળ સરકાર દ્વારા હાથ ધરવામાં આવેલી યોજનાઓની નોંધણીની પ્રક્રિયા ઓનલાઈન છે. આ ક્રમમાં, સોશિયલ મીડિયા પર દરરોજ આવા ઘણા સંદેશાઓ ફોરવર્ડ કરવામાં આવે છે, જેની સરકાર દ્વારા જાહેરાત કરવામાં આવી હોતી નથી. આ સંદેશાઓમાં મોબાઈલ રિચાર્જ, ડેટા અને અભ્યાસ સંબંધિત ઘણા આકર્ષક વચનો ફોરવર્ડ કરવામાં આવે છે.",,,"Dec 8, 2021",-Fabricated News,newschecker.in,પ્રધાનમંત્રી રામબાણ સુરક્ષા યોજના સાથે રૂ 4000ની સહાય આપવામાં આવતી હોવાના ભ્રામક દાવા સાથે પોસ્ટ વાયરલ,https://newschecker.in/gu/fact-checks-gu/fact-checks-gu/prime-minister-ramban-scheme-fake-viral-message,gu,Gujarati,newschecker_scrape,html_fallback
"દેશના ઘણા રાજ્યોમાંથી કોરોનાના નવા પ્રકાર ‘ઓમિક્રોન’ના કેસો સામે આવી રહ્યા છે. રાજસ્થાનના જયપુરમાં કોરોના વાયરસના નવા પ્રકાર ઓમિક્રોનના 9 કેસ નોંધાયા છે. દક્ષિણ આફ્રિકાથી પરત ફરેલા ચાર લોકોમાં ઓમિક્રોન વેરિઅન્ટ જોવા મળ્યું હતું, ત્યારબાદ તેમને આરયુએચએસ હોસ્પિટલમાં દાખલ કરવામાં આવ્યા હતા. આ ઉપરાંત, આ લોકોના સંપર્કમાં આવેલા વધુ પાંચ લોકોમાં પણ ઓમિક્રોન વેરિઅન્ટની પુષ્ટિ થઈ છે.",,,"Dec 7, 2021",- False,newschecker.in,"રાજસ્થાનમાં ઓમિક્રોનના વધતા જતા કેસોને કારણે શૈક્ષણિક સંસ્થાઓ બંધ રાખવાનો સરકારી લેટર વાયરલ, જાણો શું છે સત્ય",https://newschecker.in/gu/fact-checks-gu/fact-checks-gu/rajasthan-fake-order-home-department-to-close-educational-institutions,gu,Gujarati,newschecker_scrape,html_fallback
"ઉત્તરપ્રદેશમાં નજીકના સમયમાં વિધાનસભા ચૂંટણી આવી રહી છે. ઉપરાંત હાલમાં PM મોદી વારાણસી ખાતે નવ નિર્માણ થયેલા કાશી વિશ્વનાથ ધામનું લોકાર્પણ કર્યું હતું. આ તમામ પ્રસંગો અંગે સોશ્યલ મીડિયા પર અનેક પોસ્ટ જોવા મળે છે, જે ક્રમમાં CM યોગી આદિત્યનાથના કાફલા પર હુમલો થયો હોવાના દાવા સાથે એક વિડિઓ શેર કરવામાં આવ્યો છે.",,,"Dec 15, 2021",- Misplaced Context,newschecker.in,CM યોગી આદિત્યનાથના કાફલા પર હુમલો થયો હોવાના દાવા સાથે 2017માં બનેલ ઘટનાનો વિડિઓ વાયરલ,https://newschecker.in/gu/fact-checks-gu/fact-checks-gu/student-attacked-cm-yogi-cars,gu,Gujarati,newschecker_scrape,html_fallback
"ચીફ ઑફ ડિફેન્સ સ્ટાફ જનરલ બિપિન રાવતના હેલિકોપ્ટર ક્રેશના અહેવાલો આવ્યાના કલાકોમાં, સોશ્યલ મીડિયા પર યુઝર્સ દ્વારા Mi 17નો એક વિડિયો પોસ્ટ કરવામાં આવ્યો હતો. વિડીઓમાં એક ચોપર જમીન પર પટકાય છે, વિડિઓ સાથે દાવો કરવામાં આવ્યો હતો કે આ ચોપરમાં જનરલ બિપિન રાવત સહીત અન્ય લોકો હાજર હતા. જયારેnewscheckerદ્વારા આ અંગે ખુલાસો કરતા જણાવ્યું છે, વાયરલ વિડિઓ અંરુણાચલમાં નવેમ્બર મહિનામાં બનેલ ઘટના છે.",,,"Dec 10, 2021",- Misplaced Context,newschecker.in,સીરિયામાં થયેલ ચોપર ક્રેશના વિડિઓને જનરલ બિપિન રાવતના હેલિકોપ્ટર ક્રેશનો હોવાના દાવા સાથે વાયરલ,https://newschecker.in/gu/fact-checks-gu/fact-checks-gu/syrian-helicopter-shot-down-video-shared-as-bipin-rawats-crash,gu,Gujarati,newschecker_scrape,html_fallback
"મહારાષ્ટ્રના બોર્ડર નજીક આવેલ ગઢચિરોલી વિસ્તારમાં નક્સલીઓ અને પોલીસ વચ્ચે અથડામણો થઈ હતી, જેમાં કેટલાક નક્સલીઓ માર્યા ગયા હતા. પોલીસ અથડામણમાં મૃત્યુ પામેલા નક્સલીઓની ખબર સાથે સોશ્યલ મીડિયા પર એક વિડિઓ વાયરલ થયો છે. આ વિડીઓમાં ભારતીય જવાનો નક્સલીઓના શબ લઈને ગઢચિરોલી હેડક્વાર્ટર પરત ફર્યા હતા, જ્યાં તેમની ટીમનું ઢોલ-નગારા વગાડીને સ્વાગત કરાયું હતું.",,,"Nov 23, 2021",- Misleading / Partly False,newschecker.in,ગઢચિરોલી ખાતે 26 નક્સલીના શબ લઈને કમાન્ડો પરત ફર્યા અને તેમના સ્વાગતમાં ઢોલ વગાડવામાં આવ્યા હોવાનો ભ્રામક વિડિઓ વાયરલ,https://newschecker.in/gu/fact-checks-gu/fact-checks-gu/26-naxalite-gadchiroli-maharashtra,gu,Gujarati,newschecker_scrape,html_fallback
પ્રધાનમંત્રી નરેન્દ્ર મોદીએ નોઈડા જેવર ખાતે એશિયાના સોથી મોટા અને વિશ્વના ચોથા સૌથી મોટા એરપોર્ટ (Noida International Airport) નો શિલાન્યાસ કર્યો. આ સાથે જ નોઈડા ઇન્ટરનેશનલ એરપોર્ટ એશિયાનું સૌથી મોટું એરપોર્ટ અને ફર્સ્ટ નેટ ઝીરો એમિશન (પ્રદુષણ મુક્ત) એરપોર્ટ હશે. જેવર એરપોર્ટના શિલાન્યાસ બાદ અનેક મંત્રીઓ અને ન્યુઝ સંસ્થાન દ્વારા સોશ્યલ મીડિયા પર નવા એરપોર્ટની શુભકામના પાઠવતી પોસ્ટ શેર કરવામાં આવેલ છે.,,,"Nov 26, 2021",- Misleading,newschecker.in,"ન્યુઝ ચેનલો અને નેતાઓ એ શેર કરી જેવર એરપોર્ટની ભ્રામક તસ્વીર, જાણો શું છે સત્ય",https://newschecker.in/gu/fact-checks-gu/fact-checks-gu/beijing-daxing-airport-image-viral-noida-jewar-airport,gu,Gujarati,newschecker_scrape,html_fallback
"નેપાળના પહાડો માંથી એક સાધુ મળી આવ્યા છે, જેની ઉમર 201 વર્ષ હોવાના દાવા સાથે એક તસ્વીર વાયરલ થયેલ છે.સોશ્યલ મીડિયાપર આ સાધુ દુનિયાના સૌથી વૃદ્ધ વ્યક્તિ તેમજ જીવિત હોવાના દાવા સાથે તસ્વીર શેર કરવામાં આવેલ છે.",,,"Dec 2, 2021",- False,newschecker.in,નેપાળના પહાડો માંથી 201 વર્ષની ઉમરના સાધુ મળી આવ્યા હોવાના ભ્રામક દાવા સાથે તસ્વીર વાયરલ,https://newschecker.in/gu/fact-checks-gu/fact-checks-gu/buddhist-monk-body-nepal-201-year,gu,Gujarati,newschecker_scrape,html_fallback
ઓસ્ટ્રેલિયાના એક ખેલાડીએ ભારત માતા કી જયના ​​નારા લગાવ્યા અને વેસ્ટેન્ડિઝ ખેલાડી ક્રિસ ગેલ ક્રિકેટ માંથી નિવૃત્તિ લીધી બીજી તરફ કંગના રનૌતને એવોર્ડ આપવાના સંદર્ભે મહિલાઓએ વિરોધ નોંધાવ્યો હોવાના દાવા પર Newschecker દ્વારા કરવામાં આવેલ ફેક્ટ ચેક,,,"Nov 20, 2021",,newschecker.in,WeeklyWrap : T20 વર્લ્ડ કપમાં ભારતની હાર અને પાકિસ્તાનની જીત થી લઇ કંગના રનૌતને પદ્મશ્રી એવોર્ડ મળ્યો હોવાના સંદર્ભે વાયરલ થયેલ ભ્રામક ખબરો,https://newschecker.in/gu/fact-checks-gu/fact-checks-gu/fact-checks-weeklywrap-top-5-fake-news-14,gu,Gujarati,newschecker_scrape,html_fallback
ડ્રગ્સ માફિયાના આરોપી AAP કાર્યકર્તા તો ગઢચિરોલી ખાતે 26 નક્સલીના શબ લઈને કમાન્ડો પરત ફર્યા અને ન્યુઝ ચેનલો એ શેર કરી જેવર એરપોર્ટની ભ્રામક તસ્વીર તેમજ કાશી વિશ્વનાથ મંદિર અંગે ફેલાયેલ ભ્રામક અફવાઓ અંગે TOP 5 ફેક્ટ ચેક,,,"Nov 27, 2021",,newschecker.in,WeeklyWrap : ગુજરાતમાં ડ્રગ્સ માફિયા અને નક્સલીઓ થી લઇ જેવર એરપોર્ટ અંગે ફેલાયેલ ભ્રામક ખબરો,https://newschecker.in/gu/fact-checks-gu/fact-checks-gu/fact-checks-weeklywrap-top-5-fake-news-15,gu,Gujarati,newschecker_scrape,html_fallback
"શિવસેનાના સીએમ ઉદ્ધવ ઠાકરેની આગેવાની હેઠળની મહા વિકાસ અઘાડી સરકારે સ્કૂલના અરજી ફોર્મ માંથી ‘હિંદુ’ની શ્રેણી દૂર કરી દીધી છે. ન્યૂઝચેકર દ્વારા હકીકત તપાસમાં દાવો ખોટો હોવાનું જાણવા મળ્યું છે.સોશ્યલ મીડિયાપર મહારાષ્ટ્ર્ર સરકારનું HSC અને SSC પરીક્ષાનું ફોર્મ વાયરલ થયેલ છે, વિવાદની વાત એ છે કે, આ ફોર્મ માંથી ‘હિન્દૂ’ ધર્મનું કોલમ હટાવવામાં આવ્યું છે.",,,"Dec 1, 2021",-Misleading,newschecker.in,મહારાષ્ટ્ર સરકાર દ્વારા બોર્ડના પરીક્ષા ફોર્મ માંથી ‘હિન્દૂ’ કોલમ હટાવવામાં આવ્યું હોવાના દાવા સાથે તસ્વીર વાયરલ,https://newschecker.in/gu/fact-checks-gu/fact-checks-gu/govt-did-not-drop-hindu-from-maharashtra-ssc-hsc-board-application-form,gu,Gujarati,newschecker_scrape,html_fallback
"ભારત સરકાર દ્વારા થોડા દિવસ પહેલા પદ્મશ્રી, પદ્મભૂષણ એવોર્ડ એનાયત કરવામાં આવ્યા હતા, જેમાં કેટલાક દિગ્ગ્જ્જોને મરણોપરાંત સન્માનિત કરવામાં આવ્યા છે. આ ક્રમમાં બોલીવુડ એક્ટર  કંગના રનૌતને પદ્મશ્રી  એવોર્ડ આપવામાં આવ્યો છે, જે બાદ સોશ્યલ મીડિયા પર અનેક ચર્ચાઓ થવા લાગી હતી. કેટલાક લોકો કંગના રનૌતને પદ્મશ્રી એવોર્ડ આપવાના વિરોધમાં પણ પોસ્ટ કરી રહ્યા હતા. ઉલ્લેખનીય છે કે કંગનાએ એક મીડિયા ઇન્ટરવ્યૂ દરમિયાન કહ્યું હતું કે “ભારતને ખરી આઝાદી 2014માં મળી છે” જે બાદ સોશ્યલ મીડિયા પર કંગના રનૌતને એવોર્ડ આપવા મુદ્દે ખુબ જ ટ્રોલ શરૂ થયા હતા.",,,"Nov 17, 2021",- Misplaced Context,newschecker.in,કંગના રનૌતને એવોર્ડ આપવાના સંદર્ભે મહિલાઓએ પોસ્ટર પર કાળો રંગ લાગવી વિરોધ કર્યો હોવાનો વિડિઓ વાયરલ,https://newschecker.in/gu/fact-checks-gu/fact-checks-gu/kangana-ranaut-gets-padma-shri-protest,gu,Gujarati,newschecker_scrape,html_fallback
"છેલ્લા થોડા સમય દરમિયાન ગુજરાતમાં ડ્રગ્સ માફિયાનું જોર વધ્યું હોવાનું જાણતા ગુજરાત ATS દ્વારા અનેક જગ્યાએ દરોડા પાડી કરોડોનો ડ્રગ્સનો જથ્થો પકડવામાં આવેલ છે. મોરબીના ઝીંઝુડા ગામથી ATS દ્વારા અંદાજે 600 કરોડનું ડ્રગ્સ જપ્ત કર્યું હતું, સાથે જ ડ્રગ્સની હેરાફેરી કરતા ત્રણ સપ્લાયરોને ઝડપી લેવામાં આવ્યા હતા. ડ્રગ્સ માફિયાના આરોપી AAP કાર્યકર્તા હોવાનો દાવો કરવામાં આવેલ છે.",,,"Nov 22, 2021",- Misleading Content,newschecker.in,મોરબી માંથી પકડાયેલા ડ્રગ્સ માફિયાના આરોપી AAP કાર્યકર્તા હોવાનો ભ્રામક દાવો વાયરલ,https://newschecker.in/gu/fact-checks-gu/fact-checks-gu/morbi-drug-peddler-caught-with-600-cr-drugs,gu,Gujarati,newschecker_scrape,html_fallback
"ભારતમાં એવા ગરીબ લોકો જેને એક ટાઇમનું જમવાનું નથી મળતું, તેવા લોકો માટે અનેક સંસ્થાઓ અને ટ્રસ્ટો દ્વારા સેવા કાર્યો કરવામાં આવતા હોય છે. સોશ્યલ મીડિયા પર સેવામાં જોડાવા અંગે પણ અનેક મેસેજ આવતા હોય છે. આ તમામ ક્રમમાં વોટસએપ અને ફેસબુક પર ”PM મોદીની જાહેરાત” ટાઇટલ સાથે એક મેસેજ ફોરવર્ડ કરવામાં આવેલ છે. વાયરલ ફોરવર્ડ મેસેજ મુજબ ચાઈલ્ડલાઈન ઈન્ડિયા ફાઉન્ડેશન નામની સંસ્થા દ્વારા એક હેલ્પલાઇન નંબર જાહેર કરવામાં આવ્યો છે, જે સંસ્થા કોઈપણ ઇવેન્ટ કે ફંકશનમાં વધેલું જમવાનું એકત્રિત કરી ગરીબ બાળકોને ખવડાવે છે.",,,"Nov 29, 2021",- False,newschecker.in,"PM મોદીની જાહેરાત : 1098 પર કૉલ કરો અને તમારા ફંક્શનમાં વધેલું જમવાનું આપો, જાણો શું છે ભ્રામક દાવાનું સત્ય",https://newschecker.in/gu/fact-checks-gu/fact-checks-gu/pm-modi-start-helpline-1098-for-leftover-food-to-needy-children,gu,Gujarati,newschecker_scrape,html_fallback
