claim_text,claimant,claim_date,review_date,rating,publisher_domain,review_title,review_url,language,language_name,data_source,extraction_method
"નીતિન સાંડેસરા 5000 કરોડના બેન્ક લોન કૌભાંડમાં જેનું નામ સામે આવેલ હતું, આ મુદ્દે સોશ્યલ મીડિયા પર એક પોસ્ટ વાયરલ થઇ રહી છે. ફેસબુક અને ટ્વીટર પર“5700 કરોડ રૂપિયા લૂંટ્યા પછી નિઝરિયાથી ભાગી ગયેલા # નીતિન_સંદેસરાનો મિત્ર કોણ છે?” કેપશન સાથે બે તસ્વીર શેર કરવામાં આવેલ છે. આ તસ્વીરમાં રાજનાથ સિંહ અને અમિત શાહ સાથે નીતિન સાંડેસરા ઉભા હોવાનો દાવો કરવામાં આવ્યો છે.",,,"Jan 4, 2021",,newschecker.in,BJP નેતાની તસ્વીરને 5000 કરોડનું કૌભાંડ કરનાર નીતિન સાંડેસરાના નામ પર ભ્રામક દાવા સાથે વાયરલ,https://newschecker.in/gu/fact-checks-gu/fact-checks-gu/ritesh-tiwari-viral-photo-with-misleading-claim-of-nitin-sandesara,gu,Gujarati,newschecker_scrape,html_fallback
"સિંઘુ બોર્ડર પર કિસાન આંદોલન હજુ પણ યથાવત છે, હાલ દિલ્હીમાં વરસાદ પણ શરૂ થયો છે. ત્યારે ઠંડી અને વરસાદના માહોલમાં પણ આંદોલનકારીઓ રસ્તા પર બેઠા છે. ત્યારે આજે એક વીડિયો સોશિયલ મીડિયા પર વાયરલ થઈ રહ્યો છે. આ વીડિયોમાં, કોઈ વૃદ્ધ વ્યક્તિ અચાનક પડતાં જોઇ શકાય છે. દાવો કરવામાં આવી રહ્યો છે કે આ વીડિયો સિંઘુ બોર્ડરનો છે. જ્યાં નવા કૃષિ કાયદા વિરુદ્ધ ચાલી રહેલા આંદોલનમાં સામેલ એક ખેડૂતનું અચાનક મોત નીપજ્યું હતું.",,,"Jan 5, 2021",,newschecker.in,"વાયરલ વિડિઓમાં કિસાનનું મૃત્યુ થયું હોવાનો ભ્રામક દાવો કરવામાં આવેલ છે, જાણો કોણ છે તે વ્યક્તિ",https://newschecker.in/gu/fact-checks-gu/fact-checks-gu/the-video-of-fainted-farmer-at-singhu-border-goes-viral-on-social-media-with-false-claim,gu,Gujarati,newschecker_scrape,html_fallback
સિંધુ બોર્ડર પર છેલ્લા ઘણા અઠવાડિયાથી ખેડુતો નવા કૃષિ કાયદાઓ અને કોર્પોરેટ કંપનીઓનો વિરોધ ચાલી રહ્યો છે. ત્યારે ખેડૂતોએ JIO સિમનો બહિષ્કાર કર્યો છે. જે બાદ અનેક JIO કંપનીના મોબાઈલ ટાવરોને પણ નુક્શન પહોંચાડવામાં આવ્યું હતુ. ત્યારે હાલમાં આવો જ એક વીડિયો ટ્વિટર પર શેર કરવામાં આવી રહ્યો છે જેમાં JIOના ટાવર સળગતા જોઇ શકાય છે. ફેસબુક પર “પંજાબ ના શેરો એ Jio ટાવર ની આગ માં આહુતી આપી” કેપશન સાથે વાયરલ વિડિઓ શેર કરવામાં આવ્યો છે.,,,"Dec 31, 2020",,newschecker.in,JIOનો ટાવર સળગાવ્યો હોવાના ભ્રામક દાવા સાથે 2017નો વિડિઓ વાયરલ,https://newschecker.in/gu/fact-checks-gu/fact-checks-gu/video-of-burning-jio-tower-is-not-related-to-farmer-protest-video-goes-viral-with-the-false-claim-on-social-media,gu,Gujarati,newschecker_scrape,html_fallback
‘રાજસ્થાનમાં દરરોજ રાત્રે સિરીહોલીની ગામમાં એક દિપડો તેના પરિવાર સાથે આવે છે અને પીપળેશ્વર મંદિરના પૂજારી (પુજારી) સાથે સૂઈ જાય છે.’આ દાવા સાથે યુઝર્સ દ્વારા વિડિઓ ફેસબુક પર શેર કરવામાં આવ્યો છે. આ વિડિઓ પોસ્ટ Rajkot Live News દ્વારા રાજેસ્થાનના મંદિરમાં પૂજારી સાથે સુવા આવતા દિપડાની માહિતી સાથે શેર કરવામાં આવેલ છે.,,,"Dec 29, 2020",,newschecker.in,"રાજેસ્થાનના મંદિરના પૂજારી સાથે દીપડા સુતા હોવાનો વાયરલ વિડિઓ ભ્રામક છે, જાણો કોણ છે એ વ્યક્તિ",https://newschecker.in/gu/fact-checks-gu/fact-checks-gu/video-of-leopard-from-south-africa-shared-as-from-a-temple-in-rajasthan,gu,Gujarati,newschecker_scrape,html_fallback
"ફાઇઝર કંપની દ્વારા કોરોના વેક્સીન પર એક હદે સફળતા મેવો લીધી છે, અમેરિકામાં કોરોના વેક્સીન લગાવવાની શરૂઆત પણ થઈ ચુકી છે. અમેરિકાના નવા રાષ્ટ્રપતિ બાઈડેનને પણ ગઈકાલે વેક્સીનનો પહેલો ડોઝ લગાવવામાં આવ્યો છે. ત્યારે સોશ્યલ મીડિયા પર એક ન્યુઝ વેબસાઈટ દ્વારા વેક્સીનની એક તસ્વીર પણ શેર કરેલ છે. જે વેક્સીનની તસ્વીર પર મેડ ઈન ચાઈના લખાયેલ જોવા મળે છે. જે મુદ્દે સોશ્યલ મીડિયા પર અનેક યુઝર્સ દ્વારા આ તસ્વીર શેર કરવામાં આવેલ છે, સાથે મેડ ઈન ચાઈના અને આત્મનિર્ભરના કેપશન પણ લખવામાં આવ્યા છે.",,,"Dec 23, 2020",,newschecker.in,ફાઇઝરની વેક્સીન ‘મેડ ઈન ચાઈના’ હોવાના દાવા સાથે ભ્રામક તસ્વીર વાયરલ,https://newschecker.in/gu/fact-checks-gu/coronavirus-gu/fact-check-covid-19-vape-vaccine-is-a-hoax,gu,Gujarati,newschecker_scrape,html_fallback
"રિલાયન્સ કંપનીના મલિક મુકેશ અંબાણી હાલમાં દાદા બન્યા છે. થોડા દિવસો અગાઉ મુકેશ અંબાણીએ તેમના પૌત્ર સાથે તસ્વીર શેર કરીને શોશ્યલ મીડિયા મારફતે જાણ કરી હતી. આ ઘટના સંબંધિત એક વિડિઓ ફેસબુક અને ટ્વીટર પર શેર થઈ રહ્યો છે, જેમાં મુકેશ અંબાણી દાદા બન્યા હોવાની ખુશીમાં પાર્ટી આપી રહ્યા છે. જ્યાં કેટલાય ફિલ્મ સ્ટાર અને અન્ય વ્યક્તિઓ હાજર છે, તેમજ સોશ્યલ ડિસ્ટન્સ અને માસ્કના નિયમનું પ્લાન પણ નથી થઇ રહ્યું હોવાના દાવા સાથે આ વિડિઓ વાયરલ કરવામાં આવ્યો છે.",,,"Dec 24, 2020",,newschecker.in,સોશ્યલ ડિસ્ટન્સ અને માસ્કના નિયમો ભૂલીને મુકેશ અંબાણી પાર્ટી આપી રહ્યા હોવાના દાવા સાથે ભ્રામક વિડિઓ વાયરલ,https://newschecker.in/gu/fact-checks-gu/fact-checks-gu/2019-video-of-ganesh-chaturthi-celebrations-of-ambani-family-shared-as-recent-violating-covid-guidelines,gu,Gujarati,newschecker_scrape,html_fallback
ભાજપ જનસંપર્ક કાર્યાલય વારાણસી વહેંચવા માટે ઓનલાઇન પ્લેટફોર્મ OLX પર મુકવામાં આવ્યું છે. સોશ્યલ મીડિયા પર 7 કરોડની કિંમત સાથે ભાજપ કાર્યલય વારાણસીની તસ્વીર પણ શેર કરવામાં આવેલ છે. OLXની જાહેરાત મુદ્દે ન્યુઝ સંસ્થાન દ્વારા પણ આ ન્યુઝ પબ્લિશ કરવામાં આવ્યા હતા.,,,"Dec 22, 2020",,newschecker.in,7 કરોડની કિંમત સાથે વારાણસી ભાજપ કાર્યાલય વહેંચવા મુકાયું હોવાનો ભ્રામક દાવો વાયરલ,https://newschecker.in/gu/fact-checks-gu/fact-checks-gu/advertisement-for-selling-narendra-modi-parliamentary-office-put-on-online-site-four-accused-in-custody,gu,Gujarati,newschecker_scrape,html_fallback
"નવા કિસાન બિલ માટે ખેડૂતોએ આંદોલન શરૂ કર્યું છે, ત્યારથી સોશિયલ મીડિયા પર આ આંદોલન અંગે રોજ નવી નવી વાતો સામે આવી રહી છે. ફરી એક વખત ખેડૂતો વિશે નવો દાવો કરવામાં આવી રહ્યો છે. સોશ્યલ મીડિયા પર એક તસવીર ખૂબ વાયરલ થઈ રહી છે. જેમાં દાવો કરવામાં આવી રહ્યો છે કે બેંગલુરુના ખેડૂતોએ પોતાનું સુપર માર્કેટ બનાવ્યું છે. અને આપણે આ ખેડુતો પાસેથી પણ કંઈક શીખવું પડશે.",,,"Dec 19, 2020",,newschecker.in,બેંગ્લોરના ખેડૂતોએ પોતાનું સુપર માર્કેટ બનાવ્યું હોવાના ભ્રામક દાવાનું સત્ય,https://newschecker.in/gu/fact-checks-gu/fact-checks-gu/bengaluru-based-start-ups-images-peddled-as-supermarket-run-by-farmers,gu,Gujarati,newschecker_scrape,html_fallback
આ અઠવાડિયામાં Newschecker દ્વારા સોશ્યલ મીડિયા પર વાયરલ થયેલ તમામ ફેકનયુઝ પર ખુલાસો કરવામાં આવ્યો છે. જેમાં 6 જનયુઆરીથી હેલ્મેટ માટે નવો કાયદો લાગુ અને રેલ એન્જિન પર અદાણીની જાહેરાત તો કિસાન આંદોલનમાં ભાજપ નેતા ઉમેશ સિંહે પાકિસ્તાન ઝિંદાબાદના નારા લાગવ્યા તેમજ નરેન્દ્ર મોદી અદાણીના પત્નીને નતમસ્તક પ્રણામ કરી રહ્યા હોવાના દાવાઓ પર ફેક્ટ ચેક,,,"Dec 19, 2020",,newschecker.in,Weekly Wrap : 6 જનયુઆરીથી હેલ્મેટ માટે નવો કાયદો લાગુ તો રેલ એન્જિન પર અદાણીની જાહેરાત અને કિસાન આંદોલનમાં ભાજપ નેતા ઉમેશ સિંહે પાકિસ્તાન ઝિંદાબાદના નારા લાગ્યા,https://newschecker.in/gu/fact-checks-gu/fact-checks-gu/fact-checks-trending-top-5-fake-news-weekly-wrap-13,gu,Gujarati,newschecker_scrape,html_fallback
"આ અઠવાડિયામાં Newschecker દ્વારા સોશ્યલ મીડિયા પર વાયરલ થયેલ તમામ ફેકનયુઝ પર ખુલાસો કરવામાં આવ્યો છે. જેમાં બેંગ્લોરના ખેડૂતોએ પોતાનું સુપર માર્કેટ બનાવ્યું,PM મોદીના ભાઈ અને તેમની સંપત્તિ-ધંધા પર વાયરલ તો 7 કરોડની કિંમત સાથે વારાણસી ભાજપ કાર્યાલય વહેંચવા મુકાયું અને ફાઇઝરની વેક્સીન ‘મેડ ઈન ચાઈના’, મુકેશ અંબાણી પાર્ટી આપી રહ્યા હોવાના ભ્રામક દાવાઓ પર TOP 5 ફેક્ટ ચેક",,,"Dec 25, 2020",,newschecker.in,Weekly Wrap : બેંગ્લોરના ખેડૂતોએ પોતાનું સુપર માર્કેટ બનાવ્યું તો PM મોદીના ભાઈઓ પાસે આટલી અધધ સંપત્તિ તો ફાઇઝરની વેક્સીન ‘મેડ ઈન ચાઈના’ હોવાના દાવાનું ફેક્ટ ચેક,https://newschecker.in/gu/fact-checks-gu/fact-checks-gu/fact-checks-trending-top-5-fake-news-weekly-wrap-14,gu,Gujarati,newschecker_scrape,html_fallback
વડાપ્રધાન મોદી અને ગૌતમ અદાણીના પત્ની સામે નતમસ્તક પ્રણામ કરી રહ્યા છે. આ દાવા સાથે સોશ્યલ મીડિયામાં એક તસ્વીર વાયરલ થયેલ છે. ફેસબુક અને ટ્વીટર પર “प्रधानमंत्री जी अडानी की बीवी रानी के सामने नतमस्तक होते हुए” કેપશન સાથે અનેક યુઝર્સ દ્વારા પોસ્ટ શેર કરવામાં આવેલ છે.,,,"Dec 17, 2020",,newschecker.in,"નરેન્દ્ર મોદી અદાણીના પત્નીને નતમસ્તક પ્રણામ નથી કરી રહ્યા, જાણો વાયરલ દાવાનું સત્ય",https://newschecker.in/gu/fact-checks-gu/fact-checks-gu/fake-alert-no-pm-modi-isnt-bowing-down-in-front-of-adanis-wife,gu,Gujarati,newschecker_scrape,html_fallback
"ભાજપના એક નેતા હાલના ખેડૂતો આંદોલનમાં તોડફોડ કરવા માટે ‘પાકિસ્તાન ઝિંદાબાદ’ ના નારા લગાવતા પકડાયા હતા. જેમનો વીડિયો વાયરલ થઈ રહ્યો છે. જેમાં દાવો કરવામાં આવ્યો છે, કે આ વ્યક્તિ ભાજપના નેતા ઉમેશ સિંહ છે. જેને પાકિસ્તાનને સમર્થન આપવાના વિરોધમાં સૂત્રોચ્ચાર કર્યા બાદ ખેડૂતોએ તેમને માર માર્યો હતો. ફેસબુક અને ટ્વીટર પર“વિરોધ પ્રદર્શનમાં ભાગ લેનારા અને પાકિસ્તાન જિંદાબાદના નારા લગાવનારા ભાજપ નેતા ઉમેશ સિંહને ખેડૂતોએ માર માર્યો હતો”કેપશન સાથે વિડિઓ શેર કરવામાં આવેલ છે.",,,"Dec 16, 2020",,newschecker.in,કિસાન આંદોલનમાં ભાજપ નેતા ઉમેશ સિંહે પાકિસ્તાન ઝિંદાબાદના નારા લાગવ્યા હોવાના ભ્રામક દાવા સાથે વિડિઓ વાયરલ,https://newschecker.in/gu/fact-checks-gu/fact-checks-gu/farmers-protest-anti-national-slogan-bjp-viral-video-social-media,gu,Gujarati,newschecker_scrape,html_fallback
“હરિયાણાના અદાણીના અનાજ સંગ્રહના ગોડાઉનોનો પર્દાફાશ કરનાર કરનાલના ફોટો જર્નાલિસ્ટ ચાર્મ્સ ઉપ્પલ પર જીવલેણ હુમલો” કેપશન સાથે એક તસ્વીર સોશ્યલ મીડિયા પર શેર કરવામાં આવેલ છે. નોંધનીય છે કે હાલમાં કિસાન બિલના વિરોધમાં પંજાબ અને હરિયાણાના ખેડૂતો દિલ્હી બોર્ડર પર આંદોલન કરી રહ્યા છે. જે આંદોલનમાં અદાણી અને અંબાણીનો વિરોધ પણ કરવામાં આવી રહ્યો છે.,,,"Dec 18, 2020",,newschecker.in,અદાણીના અનાજ સંગ્રહના ગોડાઉનોનો પર્દાફાશ કરનાર જર્નાલિસ્ટ પર હુમલો થયો હોવાના ભ્રામક દાવાનું સત્ય,https://newschecker.in/gu/fact-checks-gu/fact-checks-gu/journalist-attacked-for-exposing-drug-case-in-haryana-falsely-linked-to-adani-group,gu,Gujarati,newschecker_scrape,html_fallback
"ખેડૂત આંદોલન છેલ્લા ઘણા દિવસોથી ચાલી રહ્યું છે. ત્યારે કિસાનો દ્વારા 8 ડિસેમ્બરના ભારત બંધનું એલાન કરવામાં આવ્યું હતું. આ ઉપરાન્ત આ 14 ડિસેમ્બરના ઉપવાસ આંદોલન અને હાઈ-વે રોકવામાં આવ્યા હતા. તે મુદ્દે સોશ્યલ મીડિયા પર અનેલક ચર્ચાઓ ચાલી રહી છે. ત્યારે BJP નેતા કપિલ મિશ્રા પર એક તસ્વીર વાયરલ થયેલ છે, જેમાં કપિલ મિશ્રા દ્વારા ધમકી આપવામાં આવી છે, કે“ખેડૂતો જો બે દિવસમાં રસ્તાઓ ખાલી નહીં કરે તો મારે રસ્તાઓ ખાલી કરવવા જવું પડશે” આ કેપશન સાથે ટ્વીટર અને ફેસબુક પર અનેક યુઝર્સ દ્વારા પોસ્ટ શેર કરવામાં આવેલ છે.",,,"Dec 16, 2020",,newschecker.in,કપિલ મિશ્રાએ ખેડૂત આંદોલનને બે દિવસનું અલ્ટીમેટમ આપ્યું હોવાનો ભ્રામક દાવો વાયરલ,https://newschecker.in/gu/fact-checks-gu/fact-checks-gu/misleading-claim-that-kapil-mishra-gave-two-day-ultimatum-to-farmers-movement-goes-viral,gu,Gujarati,newschecker_scrape,html_fallback
"પંજાબ, હરિયાણા અને પશ્ચિમ ઉત્તર પ્રદેશના ખેડૂતો 27 નવેમ્બર, 2020 થી દિલ્હીમાં વિરોધ કરી રહ્યા છે. તેઓ સપ્ટેમ્બરમાં સંસદ દ્વારા પસાર કરાયેલા નવા ફાર્મ કાયદાઓનો વિરોધ કરી રહ્યા છે. ખેડુતો દાવો કરી રહ્યા છે કે નવા બીલો તેમને ન્યૂનતમ ટેકાના ભાવ પ્રાપ્ત કરવામાં વંચિત રાખશે. દિલ્હીમાં ચાલી રહેલા વિરોધ દરમિયાન 40થી વધુ ખેડૂતોનાં મોત નીપજ્યાં છે. ત્યારે સોશ્યલ મીડિયા પર એક તસ્વીર વાયરલ કરવામાં આવી છે, જેમાં વધુ એક ખેડૂતનું મોત થઈ હોવાનો દાવો કરવામાં આવ્યો છે.",,,"Dec 28, 2020",,newschecker.in,2018માં રસ્તા પર મળેલ લાશની તસ્વીરને હાલ ખેડૂત આંદોલનમાં થયેલ મોત ગણાવી ભ્રામક દાવા સાથે તસ્વીર વાયરલ,https://newschecker.in/gu/fact-checks-gu/fact-checks-gu/old-pic-of-2018-viral-as-another-farmer-died-at-protest-in-delhi,gu,Gujarati,newschecker_scrape,html_fallback
"વડા પ્રધાન નરેન્દ્ર મોદીના ભાઈ-બહેન અને પિતરાઇ ભાઇઓને વડા પ્રધાનના બનવાના કારણે મોટો આર્થિક લાભ થયો છે. આ મેસેજ ટ્વિટર , ફેસબુક અને વોટ્સએપ પર શેર કરવામાં આવ્યો છે .",,,"Dec 21, 2020",,newschecker.in,PM મોદીના ભાઈ અને તેમની સંપત્તિ-ધંધા પર વાયરલ થયેલ ભ્રામક દાવાનું સત્ય,https://newschecker.in/gu/fact-checks-gu/fact-checks-gu/viral-message-targeting-pm-modis-family-is-a-work-of-fiction,gu,Gujarati,newschecker_scrape,html_fallback
"હવે ATMમાંથી બે હજાર રૂપિયાની નોટ નહીં મળે. રિઝર્વ બેંકમાંથી બે હજારની નોટ હાલમાં બંધ કરી દેવામાં આવી છે. બેંક પણ એટીએમ મશીનમાંથી બે હજારની નોટવાળા કેલિબર કાઢવા લાગી છે. સેન્ટ્રલ બેંક ઓફ ઈન્ડિયાએ તેની શરૂઆત કરી દીધી છે. સેન્ટ્રલ બેંક પોતાના 58 એટીએમ મશીનમાંથી કેલિબર કાઢી નાખ્યા છે. અન્ય બેંકોનું પણ કહેવુ છે કે, હવે એટીએમમાં ફક્ત 100,200 અને 500 રૂપિયાની નોટ જ લોડ કરવામાં આવશે. “ATM માંથી હવે નહીં નીકળે 2000ની નોટ” કેપશન સાથે ન્યુઝ સંસ્થાન jaihindnewspaper અને westerntimesnews દ્વારા આર્ટિકલ પબ્લિશ કરવામાં આવેલ છે.",,,"Dec 4, 2020",,newschecker.in,RBI દ્વારા 2000ની નોટ બંધ કરવામાં આવી હોવાનો ભ્રામક દાવો વાયરલ,https://newschecker.in/gu/fact-checks-gu/fact-checks-gu/2000-notes-have-been-discontinued-by-rbi-false-claim-viral,gu,Gujarati,newschecker_scrape,html_fallback
